{
  "version": "0.1.0",
  "reviewed_at": "2026-03-26",
  "nodes": [
    {
      "id": "repo-readme",
      "path": "README.md",
      "role": "entrypoint",
      "depends_on": [],
      "verify_commands": [
        "npm run check:docs",
        "npm run check:dependency-graph"
      ]
    },
    {
      "id": "law-and-schema",
      "path": "schemas/capsule-schema.json",
      "role": "foundational-contract",
      "depends_on": [],
      "verify_commands": [
        "npm run audit:public-surface",
        "npm run check:dependency-graph"
      ]
    },
    {
      "id": "validator-http-contract",
      "path": "openapi/validate.openapi.json",
      "role": "foundational-contract",
      "depends_on": [],
      "verify_commands": [
        "npm run check:api-schemas",
        "npm run check:dependency-graph"
      ]
    },
    {
      "id": "examples-and-fixtures",
      "path": "PUBLIC_EXAMPLE_COVERAGE.json",
      "role": "derived-example-layer",
      "depends_on": [
        "law-and-schema",
        "validator-http-contract"
      ],
      "verify_commands": [
        "npm run check:example-coverage",
        "npm run check:dependency-graph"
      ]
    },
    {
      "id": "provenance-and-boundaries",
      "path": "SOURCE_MANIFEST.json",
      "role": "foundational-governance",
      "depends_on": [
        "repo-readme"
      ],
      "verify_commands": [
        "npm run audit:public-surface",
        "npm run check:dependency-graph"
      ]
    },
    {
      "id": "reviewer-summaries",
      "path": "PUBLIC_PROJECT_PROFILE.json",
      "role": "reviewer-summary",
      "depends_on": [
        "repo-readme",
        "provenance-and-boundaries"
      ],
      "verify_commands": [
        "npm run check:project-profile",
        "npm run check:dependency-graph"
      ]
    },
    {
      "id": "maintenance-and-change",
      "path": "PUBLIC_MAINTENANCE_MODEL.json",
      "role": "governance-summary",
      "depends_on": [
        "repo-readme",
        "provenance-and-boundaries"
      ],
      "verify_commands": [
        "npm run check:maintenance-model",
        "npm run check:change-control",
        "npm run check:dependency-graph"
      ]
    },
    {
      "id": "ownership-and-authority",
      "path": "PUBLIC_OWNERSHIP_MAP.json",
      "role": "authority-summary",
      "depends_on": [
        "provenance-and-boundaries",
        "maintenance-and-change"
      ],
      "verify_commands": [
        "npm run check:ownership-map",
        "npm run check:dependency-graph"
      ]
    },
    {
      "id": "traceability-and-capabilities",
      "path": "PUBLIC_TRACEABILITY_MATRIX.json",
      "role": "reviewer-map",
      "depends_on": [
        "examples-and-fixtures",
        "reviewer-summaries",
        "ownership-and-authority"
      ],
      "verify_commands": [
        "npm run check:traceability",
        "npm run check:capability-matrix",
        "npm run check:dependency-graph"
      ]
    },
    {
      "id": "release-evidence",
      "path": "PUBLIC_RELEASE_METADATA.json",
      "role": "release-summary",
      "depends_on": [
        "examples-and-fixtures",
        "provenance-and-boundaries",
        "maintenance-and-change",
        "ownership-and-authority",
        "traceability-and-capabilities"
      ],
      "verify_commands": [
        "npm run check:release",
        "npm run check:dependency-graph"
      ]
    },
    {
      "id": "assurance-and-limits",
      "path": "PUBLIC_ASSURANCE_CASE.json",
      "role": "assurance-summary",
      "depends_on": [
        "reviewer-summaries",
        "traceability-and-capabilities",
        "release-evidence"
      ],
      "verify_commands": [
        "npm run check:assurance-case",
        "npm run check:dependency-graph"
      ]
    },
    {
      "id": "update-coherence-and-sync",
      "path": "PUBLIC_UPDATE_COHERENCE_MAP.json",
      "role": "sync-summary",
      "depends_on": [
        "maintenance-and-change",
        "release-evidence",
        "assurance-and-limits"
      ],
      "verify_commands": [
        "npm run check:update-coherence",
        "npm run check:dependency-graph"
      ]
    },
    {
      "id": "limitations-and-deferred-scope",
      "path": "PUBLIC_LIMITATIONS_REGISTER.json",
      "role": "limitations-summary",
      "depends_on": [
        "provenance-and-boundaries",
        "assurance-and-limits",
        "update-coherence-and-sync"
      ],
      "verify_commands": [
        "npm run check:limitations-register",
        "npm run check:dependency-graph"
      ]
    },
    {
      "id": "maintenance-evolution",
      "path": "PUBLIC_EVIDENCE_TIMELINE.json",
      "role": "maintenance-evidence",
      "depends_on": [
        "reviewer-summaries",
        "release-evidence"
      ],
      "verify_commands": [
        "npm run check:evidence-timeline",
        "npm run check:dependency-graph"
      ]
    },
    {
      "id": "review-scorecard",
      "path": "PUBLIC_REVIEW_SCORECARD.json",
      "role": "reviewer-scorecard",
      "depends_on": [
        "reviewer-summaries",
        "release-evidence",
        "maintenance-evolution"
      ],
      "verify_commands": [
        "npm run check:review-scorecard",
        "npm run check:dependency-graph"
      ]
    },
    {
      "id": "verification-coverage",
      "path": "PUBLIC_VERIFICATION_MATRIX.json",
      "role": "verification-summary",
      "depends_on": [
        "release-evidence",
        "review-scorecard"
      ],
      "verify_commands": [
        "npm run check:verification-matrix",
        "npm run check:dependency-graph"
      ]
    },
    {
      "id": "audience-entry-paths",
      "path": "PUBLIC_AUDIENCE_PATHS.json",
      "role": "audience-summary",
      "depends_on": [
        "reviewer-summaries",
        "verification-coverage"
      ],
      "verify_commands": [
        "npm run check:audience-paths",
        "npm run check:dependency-graph"
      ]
    },
    {
      "id": "evidence-strength",
      "path": "PUBLIC_EVIDENCE_STRENGTH_MAP.json",
      "role": "authority-summary",
      "depends_on": [
        "reviewer-summaries",
        "audience-entry-paths"
      ],
      "verify_commands": [
        "npm run check:evidence-strength",
        "npm run check:dependency-graph"
      ]
    },
    {
      "id": "adoption-readiness",
      "path": "PUBLIC_ADOPTION_READINESS.json",
      "role": "readiness-summary",
      "depends_on": [
        "audience-entry-paths",
        "evidence-strength",
        "limitations-and-deferred-scope",
        "release-evidence"
      ],
      "verify_commands": [
        "npm run check:adoption-readiness",
        "npm run check:dependency-graph"
      ]
    },
    {
      "id": "freshness-and-staleness",
      "path": "PUBLIC_FRESHNESS_MODEL.json",
      "role": "freshness-summary",
      "depends_on": [
        "release-evidence",
        "maintenance-evolution",
        "evidence-strength",
        "adoption-readiness"
      ],
      "verify_commands": [
        "npm run check:freshness",
        "npm run check:dependency-graph"
      ]
    },
    {
      "id": "ecosystem-value-and-program-fit",
      "path": "PUBLIC_ECOSYSTEM_VALUE_MAP.json",
      "role": "ecosystem-value-summary",
      "depends_on": [
        "reviewer-summaries",
        "evidence-strength",
        "adoption-readiness",
        "freshness-and-staleness"
      ],
      "verify_commands": [
        "npm run check:ecosystem-value",
        "npm run check:dependency-graph"
      ]
    },
    {
      "id": "public-decision-rationale",
      "path": "PUBLIC_DECISION_LOG.json",
      "role": "decision-rationale-summary",
      "depends_on": [
        "provenance-and-boundaries",
        "reviewer-summaries",
        "assurance-and-limits",
        "maintenance-evolution"
      ],
      "verify_commands": [
        "npm run check:decision-log",
        "npm run check:dependency-graph"
      ]
    },
    {
      "id": "public-evidence-gaps",
      "path": "PUBLIC_EVIDENCE_GAPS_REGISTER.json",
      "role": "evidence-gap-summary",
      "depends_on": [
        "limitations-and-deferred-scope",
        "adoption-readiness",
        "freshness-and-staleness",
        "ecosystem-value-and-program-fit"
      ],
      "verify_commands": [
        "npm run check:evidence-gaps",
        "npm run check:dependency-graph"
      ]
    },
    {
      "id": "public-program-fit",
      "path": "PUBLIC_PROGRAM_FIT_MAP.json",
      "role": "program-fit-summary",
      "depends_on": [
        "reviewer-summaries",
        "ecosystem-value-and-program-fit",
        "public-evidence-gaps",
        "release-evidence"
      ],
      "verify_commands": [
        "npm run check:program-fit",
        "npm run check:dependency-graph"
      ]
    }
  ],
  "reading_paths": [
    {
      "id": "reviewer-fast-path",
      "audience": "reviewers",
      "steps": [
        "repo-readme",
        "reviewer-summaries",
        "assurance-and-limits",
        "limitations-and-deferred-scope",
        "evidence-strength",
        "adoption-readiness",
        "release-evidence",
        "maintenance-evolution",
        "review-scorecard",
        "verification-coverage",
        "audience-entry-paths",
        "update-coherence-and-sync",
        "freshness-and-staleness",
        "ecosystem-value-and-program-fit",
        "public-program-fit",
        "public-decision-rationale",
        "public-evidence-gaps"
      ]
    },
    {
      "id": "integrator-contract-path",
      "audience": "integrators",
      "steps": [
        "repo-readme",
        "audience-entry-paths",
        "evidence-strength",
        "adoption-readiness",
        "law-and-schema",
        "validator-http-contract",
        "examples-and-fixtures",
        "release-evidence",
        "freshness-and-staleness",
        "ecosystem-value-and-program-fit"
      ]
    },
    {
      "id": "contributor-governance-path",
      "audience": "contributors",
      "steps": [
        "repo-readme",